{
  "id" : 2055156154599552,
  "name" : "离心机 CF-101",
  "description" : "连续动力设备",
  "templateId" : 2055156142794880,
  "dirName" : "离心机 CF-101",
  "generalInfo" : {
    "createTime" : 1790582082714,
    "location" : {
      "altitude" : 308.1036630235405,
      "latitude" : -44.46118949602416,
      "longitude" : 114.67028126524986
    },
    "virtualStableName" : "vst_连续动力设备_gl6ss4",
    "virtualTableName" : "vt_离心机 CF-101_1ky6cr",
    "keywordValues" : {
      "KEYWORD1" : "centrifuge_101"
    }
  },
  "attributes" : [ {
    "id" : 2055156154603651,
    "defaultValue" : "离心机 CF-101",
    "attrTempId" : 2055156143814784
  }, {
    "id" : 2055156154603652,
    "defaultValue" : "${KEYWORD1}",
    "attrTempId" : 2055156144339072
  } ],
  "parents" : [ {
    "id" : 2055156153895040,
    "referenceType" : "ParentChild"
  } ]
}