{
  "id" : 2055156154132608,
  "name" : "合成釜 A-101",
  "description" : "间歇反应釜",
  "templateId" : 2055156139915392,
  "dirName" : "合成釜 A-101",
  "generalInfo" : {
    "createTime" : 1790582082601,
    "location" : {
      "altitude" : 3760.286259458085,
      "latitude" : -38.24793798295281,
      "longitude" : -150.40136835424255
    },
    "virtualStableName" : "vst_间歇反应设备_nq0wah",
    "virtualTableName" : "vt_合成釜 A-101_gjz5zm",
    "keywordValues" : {
      "KEYWORD1" : "reactor_a101"
    }
  },
  "attributes" : [ {
    "id" : 2055156154140805,
    "defaultValue" : "合成釜 A-101",
    "attrTempId" : 2055156142205056
  }, {
    "id" : 2055156154140806,
    "defaultValue" : "${KEYWORD1}",
    "attrTempId" : 2055156142504064
  } ],
  "parents" : [ {
    "id" : 2055156153895040,
    "referenceType" : "ParentChild"
  } ]
}