{
  "id" : 2055156159977600,
  "name" : "燃煤锅炉 B-01",
  "description" : "能源计量表",
  "templateId" : 2055156146022528,
  "dirName" : "燃煤锅炉 B-01",
  "generalInfo" : {
    "createTime" : 1790582084030,
    "location" : {
      "altitude" : 4866.066268246121,
      "latitude" : 66.78154173940581,
      "longitude" : 117.51451782891564
    },
    "virtualStableName" : "vst_能源计量表_i7i6zt",
    "virtualTableName" : "vt_燃煤锅炉 B-01_q3pf1g",
    "keywordValues" : {
      "KEYWORD1" : "boiler_b01"
    }
  },
  "attributes" : [ {
    "id" : 2055156159993985,
    "defaultValue" : "产线总电表 E01",
    "attrTempId" : 2055156146526336
  }, {
    "id" : 2055156159993986,
    "defaultValue" : "${KEYWORD1}",
    "attrTempId" : 2055156146833536
  } ],
  "parents" : [ {
    "id" : 2055156155938944,
    "referenceType" : "ParentChild"
  } ]
}