{
  "id" : 2055478834518144,
  "name" : "mysql模板",
  "templateId" : 2055478444214400,
  "dirName" : "mysql模板",
  "generalInfo" : {
    "createTime" : 1790660862051,
    "categories" : [ ],
    "location" : { },
    "additionalAttributes" : [ ],
    "virtualStableName" : "vst_mysql模板_mo90en",
    "virtualTableName" : "vt_mysql模板_t9q6h1",
    "keywordValues" : {
      "KEYWORD1" : "demo"
    }
  },
  "attributes" : [ {
    "id" : 2055478833105024,
    "name" : "tag",
    "description" : "",
    "constantItem" : false,
    "hidden" : false,
    "excluded" : false,
    "categories" : [ 23 ],
    "valueType" : "Varchar",
    "valueLength" : 64,
    "defaultValue" : "",
    "dataReferenceSetting" : {
      "dataReferenceType" : "TDengineTag",
      "connectionId" : 2055478375004288,
      "dbName" : "idmp",
      "targetConnectionId" : 2055155571251328,
      "childTable" : "vt_mysql模板_t9q6h1",
      "columnName" : "tag",
      "sourceDBName" : "idmp",
      "sourceTimestampColumnName" : "ts",
      "tagQueryMode" : "SIMPLE",
      "tagReadMode" : "LATEST_ROW",
      "sourceChildTable" : "demo",
      "sourceColumnName" : "name",
      "verified" : true,
      "autoCreated" : false
    },
    "additionalProperties" : [ ],
    "attrTempId" : 2055478767712384
  } ],
  "parents" : [ {
    "id" : 2055156148332672,
    "referenceType" : "ParentChild"
  } ]
}