{
  "id" : 2055156148332672,
  "name" : "氯化亚砜厂",
  "templateId" : 2055156139219072,
  "dirName" : "氯化亚砜厂",
  "generalInfo" : {
    "createTime" : 1790582081189,
    "virtualStableName" : "vst_厂区中心_7gmvqs",
    "virtualTableName" : "vt_氯化亚砜厂_q86jao",
    "pathName" : "氯化亚砜厂"
  },
  "attributes" : [ ],
  "parents" : [ {
    "id" : 2055156148131968,
    "referenceType" : "ParentChild"
  } ]
}