{
  "id" : 2055156152875136,
  "name" : "氯气压缩机 C-301",
  "description" : "连续动力设备",
  "templateId" : 2055156142794880,
  "dirName" : "氯气压缩机 C-301",
  "generalInfo" : {
    "createTime" : 1790582082295,
    "location" : {
      "altitude" : 308.1036630235405,
      "latitude" : -44.46118949602416,
      "longitude" : 114.67028126524986
    },
    "virtualStableName" : "vst_连续动力设备_gl6ss4",
    "virtualTableName" : "vt_氯气压缩机 C-301_kmg9l8",
    "keywordValues" : {
      "KEYWORD1" : "comp_301"
    }
  },
  "attributes" : [ {
    "id" : 2055156152883331,
    "defaultValue" : "氯气压缩机 C-301",
    "attrTempId" : 2055156143814784
  }, {
    "id" : 2055156152883332,
    "defaultValue" : "${KEYWORD1}",
    "attrTempId" : 2055156144339072
  } ],
  "parents" : [ {
    "id" : 2055156151957632,
    "referenceType" : "ParentChild"
  } ]
}