{
  "id" : 2055156152342656,
  "name" : "氢气压缩机 C-302",
  "description" : "连续动力设备",
  "templateId" : 2055156142794880,
  "dirName" : "氢气压缩机 C-302",
  "generalInfo" : {
    "createTime" : 1790582082166,
    "location" : {
      "altitude" : 308.1036630235405,
      "latitude" : -44.46118949602416,
      "longitude" : 114.67028126524986
    },
    "virtualStableName" : "vst_连续动力设备_gl6ss4",
    "virtualTableName" : "vt_氢气压缩机 C-302_q3qi50",
    "keywordValues" : {
      "KEYWORD1" : "comp_302"
    }
  },
  "attributes" : [ {
    "id" : 2055156152359043,
    "defaultValue" : "氯气压缩机 C-301",
    "attrTempId" : 2055156143814784
  }, {
    "id" : 2055156152359044,
    "defaultValue" : "${KEYWORD1}",
    "attrTempId" : 2055156144339072
  } ],
  "parents" : [ {
    "id" : 2055156151957632,
    "referenceType" : "ParentChild"
  } ]
}